{
  "capture_interval_seconds": 1800,
  "lights_only_mode": false, 
  "light_threshold": 20,
  "keep_days": 7,
  "image_quality": 100,
  "resolution": {
    "width": 3280,
    "height": 2464
  },
  "storage_path": "/home/saainithil97/projects/timelapse/images",
  "log_path": "/home/saainithil97/projects/timelapse/logs/timelapse.log",
  "capture_window": {
    "enabled": false,
    "start_time": "10:00",
    "end_time": "16:00"
  },
  "camera_settings": {
    "exposure_compensation": -0.6,
    "awb_mode": "auto",
    "awb_gains_red": 1.5,
    "awb_gains_blue": 1.8,
    "metering_mode": "CentreWeighted",
    "sharpness": 1.5,
    "contrast": 1.2,
    "brightness": 0.0,
    "saturation": 1.0
  }
}

